[
  {
    "id": "story-first",
    "arrival_intent": "Follow a true story in which someone encounters a problem and something changes.",
    "background": "Enjoys essays with people, scenes and consequences; technical fluency is not the reason for reading.",
    "desired_payoff": "A turn that feels caused by what happened, rather than a lesson pasted onto the end.",
    "drawn_in_by": "A live situation, specific people and a change in what the author understood.",
    "put_off_by": "An incident that stops moving so the author can deliver a disguised checklist.",
    "name": "Story first reader",
    "invariants": [
      "Tracks people, events, and consequences before abstract instruction.",
      "Needs the account to preserve a credible connection between what happened and what changed."
    ],
    "variation_axes": [
      {
        "id": "subject_familiarity",
        "description": "How much adjacent subject knowledge the reader brings.",
        "values": [
          {
            "id": "newcomer",
            "description": "Little prior familiarity."
          },
          {
            "id": "adjacent",
            "description": "Recognizes neighboring ideas."
          },
          {
            "id": "experienced",
            "description": "Has followed similar situations closely."
          }
        ]
      },
      {
        "id": "narrative_attention",
        "description": "What most sustains attention in a story.",
        "values": [
          {
            "id": "scene_detail",
            "description": "Concrete people and scenes."
          },
          {
            "id": "causal_turn",
            "description": "Choices and consequences."
          },
          {
            "id": "reflection",
            "description": "How experience changes understanding."
          }
        ]
      }
    ]
  },
  {
    "id": "craft-admirer",
    "arrival_intent": "Watch a person make a thing and discover why its final shape works.",
    "background": "Interested in process and decisions across writing, visual design, software or other crafts.",
    "desired_payoff": "The constraints, rejected routes and particular choice become visible in the finished object.",
    "drawn_in_by": "Material details, alternatives and the moment a better question changes the work.",
    "put_off_by": "A reveal of the final artefact that skips the thinking that made it possible.",
    "name": "Craft admirer",
    "invariants": [
      "Looks for the choices and constraints that shaped the finished work.",
      "Values process details when they explain why the result has its particular form."
    ],
    "variation_axes": [
      {
        "id": "craft_experience",
        "description": "How directly the reader practices a relevant craft.",
        "values": [
          {
            "id": "observer",
            "description": "Enjoys finished work without making similar things."
          },
          {
            "id": "curious",
            "description": "Has tried related creative or technical work."
          },
          {
            "id": "practitioner",
            "description": "Regularly makes work in a related craft."
          }
        ]
      },
      {
        "id": "process_interest",
        "description": "Which part of making most interests the reader.",
        "values": [
          {
            "id": "constraints",
            "description": "Limits and available materials."
          },
          {
            "id": "alternatives",
            "description": "Rejected approaches and trade-offs."
          },
          {
            "id": "refinement",
            "description": "Iteration and the final shaping choices."
          }
        ]
      }
    ]
  },
  {
    "id": "cultural-magpie",
    "arrival_intent": "Follow a film, comic, type or cultural reference into an unexpected subject.",
    "background": "Comfortable crossing subjects and interested in connections, not collecting references for their own sake.",
    "desired_payoff": "The reference changes how the main subject can be seen.",
    "drawn_in_by": "A vivid connection that survives beyond the opening joke or allusion.",
    "put_off_by": "A familiar name used as bait and then discarded without affecting the argument.",
    "name": "Cultural magpie",
    "invariants": [
      "Enjoys connections across cultural forms and subject areas.",
      "Needs a reference to change or illuminate the subject rather than serve as disposable bait."
    ],
    "variation_axes": [
      {
        "id": "reference_familiarity",
        "description": "How familiar the reader is with the reference material.",
        "values": [
          {
            "id": "unfamiliar",
            "description": "Knows little about the reference."
          },
          {
            "id": "casual",
            "description": "Recognizes it and knows a few details."
          },
          {
            "id": "enthusiast",
            "description": "Follows the reference subject closely."
          }
        ]
      },
      {
        "id": "connection_interest",
        "description": "What kind of cross-subject connection most engages the reader.",
        "values": [
          {
            "id": "illustration",
            "description": "A reference that makes an idea easier to picture."
          },
          {
            "id": "interpretation",
            "description": "A reference that changes how the subject is understood."
          },
          {
            "id": "structure",
            "description": "A connection that reveals a shared pattern."
          }
        ]
      }
    ]
  },
  {
    "id": "curious-outsider",
    "arrival_intent": "Understand why an unfamiliar practice or problem matters without becoming a specialist.",
    "background": "Intelligent reader with little prior knowledge of this article's technical or design domain.",
    "desired_payoff": "A clear mental picture and a reason to care that can be retold in ordinary language.",
    "drawn_in_by": "Concrete examples and terms introduced when their meaning becomes necessary.",
    "put_off_by": "Insider shorthand that makes entry impossible, or a remedial lecture that stalls the story.",
    "name": "Curious outsider",
    "invariants": [
      "Wants to understand why the subject matters without becoming a specialist.",
      "Needs unfamiliar terms and practices introduced when they become useful."
    ],
    "variation_axes": [
      {
        "id": "subject_familiarity",
        "description": "The reader’s starting familiarity with the poll subject.",
        "values": [
          {
            "id": "newcomer",
            "description": "Little prior knowledge of the subject."
          },
          {
            "id": "adjacent",
            "description": "Understands a neighboring field or practice."
          },
          {
            "id": "working_knowledge",
            "description": "Knows common terms but not specialist detail."
          }
        ]
      },
      {
        "id": "explanation_tolerance",
        "description": "How the reader prefers unfamiliar ideas to be made clear.",
        "values": [
          {
            "id": "concrete_first",
            "description": "Needs examples before abstractions."
          },
          {
            "id": "analogy_welcome",
            "description": "Uses a careful analogy as a bridge."
          },
          {
            "id": "terms_ready",
            "description": "Can follow terms once briefly defined."
          }
        ]
      }
    ]
  },
  {
    "id": "human-stakes",
    "arrival_intent": "Find out how a decision affected the people who used, built or inherited the result.",
    "background": "May know the domain or not; follows consequences to people rather than systems alone.",
    "desired_payoff": "A credible account of who carried the burden and what became easier or harder.",
    "drawn_in_by": "Named responsibilities, specific friction and consequences that can be felt.",
    "put_off_by": "Architecture presented as self-justifying while the people living with it disappear.",
    "name": "Human stakes reader",
    "invariants": [
      "Follows who carried the consequences of a decision.",
      "Does not treat a system or architecture as self-justifying while affected people disappear."
    ],
    "variation_axes": [
      {
        "id": "proximity_to_consequences",
        "description": "How close the reader’s experience is to the consequences discussed.",
        "values": [
          {
            "id": "observer",
            "description": "No direct experience with similar consequences."
          },
          {
            "id": "adjacent",
            "description": "Has seen similar effects in a neighboring context."
          },
          {
            "id": "affected",
            "description": "Has personally navigated comparable consequences."
          }
        ]
      },
      {
        "id": "stakes_horizon",
        "description": "Which scale of consequence most draws attention.",
        "values": [
          {
            "id": "immediate",
            "description": "Daily friction and immediate effects."
          },
          {
            "id": "long_term",
            "description": "Accumulated effects over time."
          },
          {
            "id": "shared",
            "description": "How burdens and benefits are distributed."
          }
        ]
      }
    ]
  },
  {
    "id": "fellow-mistake-maker",
    "arrival_intent": "Recognise a fallible decision and learn how the author revised his understanding.",
    "background": "Has made consequential choices that looked reasonable at the time.",
    "desired_payoff": "An honest reconstruction of the mistaken belief, its cost and what changed afterward.",
    "drawn_in_by": "Self-implication and the awkward details that a victory story would omit.",